{
  "id": "act_000042",
  "vault": "0x1111111111111111111111111111111111111111",
  "timestamp": "2026-07-25T14:05:07Z",
  "status": "executed",
  "decision": {
    "action": "rebalance",
    "reasoning": "Morpho Blue USDC is paying 5.87% against Aave v3's 4.32% on comparable Base liquidity, and its $84.2M TVL with 91% utilization suggests the rate is demand-driven rather than an incentive artifact. Rotating a portion of idle USDC toward WETH to open a market-making range against the $12.4M USDC/WETH pool. Holding cash at the 20% mandate floor because I could not read a volatility series for WETH this tick.",
    "facts_used": ["f1", "f2", "f3", "f4", "f5", "f6"],
    "target_allocations": [
      { "asset": "USDC", "weight": 0.7 },
      { "asset": "WETH", "weight": 0.3 }
    ],
    "venue_intents": [
      {
        "venue": "uniswap",
        "kind": "swap",
        "token_in": "USDC",
        "token_out": "WETH",
        "pct_of_holdings": 0.3
      }
    ],
    "confidence": 0.68
  },
  "plan": {
    "venue": "uniswap",
    "steps": [
      {
        "target": "0x833589fCD6eDb6E08f4c7C32D4f71b54bdA02913",
        "value": "0",
        "calldata": "0x095ea7b3000000000000000000000000000000000022d473030f116ddee9f6b43ac78ba300000000000000000000000000000000000000000000000000000002540be400",
        "why": "approve Permit2 to move 10,000 USDC"
      },
      {
        "target": "0x2626664c2603336E57B271c5C0b26F421741e481",
        "value": "0",
        "calldata": "0x3593564c0000000000000000000000000000000000000000000000000000000000000060",
        "why": "swap 10,000 USDC for WETH via UniversalRouter"
      }
    ],
    "expected_effect": "swap 10,000 USDC for ~3.10 WETH",
    "expected_slippage_bps": 12
  },
  "tx_hashes": [
    "0xa1b2c3d4e5f60718293a4b5c6d7e8f90112233445566778899aabbccddeeff00",
    "0xb2c3d4e5f60718293a4b5c6d7e8f90112233445566778899aabbccddeeff0011"
  ],
  "mandate_version_before": 1,
  "mandate_version_after": 1,
  "model": {
    "backend": "ollama",
    "name": "qwen2.5:14b-instruct",
    "validation_retries": 1
  },
  "error": null,
  "duration_ms": 8420
}
